{
  "observed_pattern": "The user is interested in AI systems that improve human thinking instead of replacing it.",
  "evidence": "The user proposed a Cognitive Mirror Skill focused on behavior patterns, thinking style, AI usage habits, anti-dependence, divergent thinking, and reflection loops.",
  "confidence": "medium",
  "possible_intervention": "For future system-design discussions, ask the user to define privacy boundaries, MVP scope, and failure modes before expanding the feature set.",
  "next_growth_suggestion": "Before adding implementation details, write the five profile fields worth recording and the five fields that must never be recorded."
}
